<?xml version="1.0" encoding="UTF-8"?>

<persona xmlns:xsi="http://www.w3.org/2001/XMLSchema-instance"
xsi:noNamespaceSchemaLocation="persona.xsd">
    <nombre>Elsa</nombre>
    <mujer/>
    <fecha-de-nacimiento>
        <dia>18</dia>
        <mes>6</mes>
        <anyo>1996</anyo>
    </fecha-de-nacimiento>
    <ciudad>Pamplona</ciudad>
</persona>